journal,title,year,doi,novel_taxon,geography,age1,age2
JVP,"A Detailed description of Rugarhynchos sixmilensis, gen. et comb. nov. (Archosauriformes, Proterochampsia), and cranial convergence in snout elongation across stem and crown archosaurs",2020,10.1080/02724634.2019.1748042,,,,
JVP,"A new species of the carnivorous cynodont Chiniquodon (Cynodontia, Chiniquodontidae) from the Namibian Triassic",2020,10.1080/02724634.2019.1754231,Chiniquodon omaruruensis,Namibia,Mesozoic,Triassic
JVP,"Seabirds (Aves) from the Pleistocene Kazusa and Shimosa groups, central Japan",2020,10.1080/02724634.2019.1697277,,,,
JVP,"A new species of Trichechus Linnaeus, 1758 (Sirenia, Trichechidae), from the upper Pleistocene of southwestern Amazonia, and the evolution of Amazonian manatees",2020,10.1080/02724634.2019.1697882,Trichechus hesperamazonicus,Brazil,Cenozoic,Pleistocene
JVP,"The apex of amphicyonid hypercarnivory: solving the riddle of Agnotherium antiquum Kaup, 1833 (Mammalia, Carnivora)",2020,10.1080/02724634.2019.1705848,,,,
JVP,"A new Miocene turtle from Colombia sheds light on the evolutionary history of the extant genus Mesoclemmys Gray, 1873",2020,10.1080/02724634.2019.1716777,Mesoclemmys vanegasorum,Colombia,Cenozoic,Miocene
JVP,"A new fairy armadillo (Cingulata, Chlamyphorinae) from the upper Miocene of Argentina: first fossil record of the most enigmatic Xenarthra",2020,10.1080/02724634.2019.1716778,Chlamyphractus dimartinoi,Argentina,Cenozoic,Miocene
JVP,"Small carnivoran fauna of the Mascall Formation, Crooked River Basin, central Oregon",2020,10.1080/02724634.2019.1717506,Cryptailurus tinaynakti,United States,Cenozoic,Miocene
